title,selftext,subreddit,created_utc,name,upvote ratio,num_upvotes
Ryan Halliday - The Grifting Fraudster,"

I was excited to hear that Adam Carolla had a guest on his show that was championing Stoicism. It didn't take long for me to raise an eyebrow regarding to this author sincerity.
Ryan Halliday began the interview by replying to Adams question "" What is Stoicism?""

He replied ""Stoicism is a philosophical school that started in Rome........""
This is wrong as most people with a cursory interest in Stoicism would know. He went on to give an underwhelming summary of what this Hellenic philosophy is. I became curious of who this person is so I looked into his past .  He was a protege Of Robert Greene , the author of '48 rules of power' . Count yourself blessed if you don't of this book. It's closer to Machiavelli than anything produced by the Stoics. All about how to obtain externals through whatever means. 

The phenomena is called 'controlled opposition'. Stoicism was the ruling school of thought during Rome's peak . Stoicism spreading presents many problems for those running this world. If this philosophy is adopted correctly...fear of death , imprisonment or social disapproval loose their power . ...

Lastly the book he released before he was ""enlightened to Stoicism"" was about the media called ' Trust me I'm lying' 
Funnily enough Chrysippus  suggested not to deal with his kind ( in response to the liar paradox )",Stoicism,1630667347.0,t3_ph319s,0.63,24
stoicism now.,"why are there so many fake stoics who do not even believe in the 4 virtues, they all follow some misinterpreted version of stoicism nothing wrong with believing what you believe but don't lump completely separate beliefs into stoicism. i also think that modern day stoicism is not stoicism. in my opinion if u are not following early day stoicism you are not a stoic, you are of a different",Stoicism,1682235622.0,t3_12w058k,0.56,4
I heard this saying from Elon Musk. Id rather be optimistic and wrong than pessimistic and right,Does this go against Stoicism?,Stoicism,1666925775.0,t3_yfbuu9,0.41,0
Why (only) Marcus Aurelius?,"I don’t think I’ve ever seen a post here quoting anyone other than Marcus Aurelius. (I suspect that’s because Ryan Holiday made him mainstream?)

Of all the stoic sources I’ve read, Aurelius was perhaps the thinnest in terms of substance.

For me, I had more and better insights into stoic philosophy (or related), reading Cicero or perhaps Thucydides … 

what other good works are there in Stoicism?",Stoicism,1661879828.0,t3_x1orrx,0.41,0
How Stoics approach abortion,"Hello, fellow prokopton.

With yesterday's decision by the U.S. Supreme Court to overturn the precedent set by Roe v. Wade, which essentially allows states to ban abortion, I thought it best to allow a day of absorption before posting this. For the American women in this community especially, this can be an incredibly difficult time. So first, I would like to say that r/Stoicism (as it always has) will be a community available to provide advice on your various situations you may face in the coming weeks and months.

Now, that said, I would like to use yesterday's decision as a means to observe two different approaches to ethics, and how they can clash irreconcilably. First, I will briefly define deontological ethics and Stoic ethics.

>**Deontological Ethics:** A form of ethics that sets forth a series of moral norms and absolutes, such that an individual must adhere to them without regard for consequences. These moral absolutes are considered ""right,"" and being ""right"" is considered morally superior to being ""good."" These moral absolutes also override an individual's own personal reason, making circumstantial decisionmaking impossible. In other words, if something is ""wrong"" according to deontological ethics, then a person must *never* do it. This type of ethics is very common in religions, and often approaches humans as inherently flawed creatures that need an external correcting action.

\_\_\_\_\_\_\_\_\_\_\_\_\_\_\_\_\_\_\_\_\_\_\_\_

>**Stoic Ethics:** A form of ethics that does not set any moral absolutes regarding specific actions, but rather posits that an individual's intentionality must be based on reason and virtue--without regard for consequences. For Stoics, the ""good"" of virtue is manifest primarily in *why* an individual makes a decision, and secondarily in *how* an individual decides to respond after making a decision. It places total trust in an individual's personal reason from moment to moment--meaning that an action deemed inappropriate in one circumstance can easily be deemed appropriate in another. This type of ethics hinges on the idea that humans are inherently rational creatures that can make virtuous decisions without an external correcting action.

Okay, with that out of the way, let's dive into the matter at hand, to inform why Stoics and deontologists will typically hold conflicting views surrounding abortion.

In deontological ethics, the matter of abortion is often framed as a moral absolute, either:

* Abortion kills a defenseless human person; killing a defenseless human person is *always* bad;
* Abortion provides a woman autonomy over her own body; rejecting bodily autonomy is *always* bad.

Note, while the second view is held by some, it is irrelevant for discussion and reflection today. The first view is more predominantly held and directly affected the decision made yesterday.

In Stoic ethics, the matter of abortion is considered morally indifferent, which means that either:

* An individual will determine that, under present circumstances, abortion is an appropriate action;
* An individual will determine that, under present circumstances, abortion is an inappropriate action.

Stoics regard those who choose not to employ their own reason, but rather blindly accept the stated moral absolutes of some external authority, as fools. And a Stoic who holds some moral absolutes as a result of their prior exposure to deontological ethics must contend with those and decide whether those moral absolutes matter more than personal intentionality and virtue. This is where the irreconcilable clash comes into play. A person must make a choice: be a Stoic or be a fool. Use reason or adhere to external moral absolutes.

It is worth noting that while the U.S. Supreme Court decision to overturn Roe v. Wade was described as being because abortion is not a right guaranteed in the U.S. Constitution or its amendments, this is almost certainly a red herring used as thin veneer for their ethical foundations and the ethical foundations of those who installed them. I will not get dragged into the miasma of a pedantic debate over ""rights."" That will veer us away from the matter at hand: how humans approach ethics.

I will close how I began. r/Stoicism will keep its doors open to those who need our advice. Whether they are Stoics themselves who have temporarily been overcome by an emotionally-charged situation, or whether they are non-Stoics who simply like to hear the advice of coolheaded individuals, it matters not. With this issue, as with all others, this community is here to help, just as our ancient Greek predecessors were on the Stoa Poikile of Athens all those centuries ago.",Stoicism,1656157903.0,t3_vkdenr,0.54,3
Relationship advice...,Recently had an argument with my gf... She was already irriated and needed someone to listen her... I was listening her calmly... And when i gave my opinion to her about materialistic things... She suddenly said i dont need your lessons on being a good person... Keep your knowledge limited to yourself... I felt disrespected and lashed out on her... In the she said im sorry for saying these things but i was already irritated and having mood swings... I just needed someone to hear me out... In the i also realised i went overboard.. but now im feeling the guilt like she needed someone to talk and i did this... Any help on how to tackle this?,Stoicism,1701058256.0,t3_184u68g,0.5,0
How do I move on?,"I had a summer fling with a girl and when she left we exchanged instagrams and whatsapp before she left. We kept in touch for 6 weeks and were calling each other once a week. I accidentally unfollowed her one day and was embarrassed so I didn't tell her. Lately, she hasn't been responding and yesterday she said she wants to stop talking and it seems that we're on the same page since I don't follow her on Instagram. I'm frustrated that a miscommunication led to such a fallout but I also am frustrated she won't hear me out. I know I can't control other people and that all I can do is respect her not wanting to talk but it feels tragic for it all to end like this. ",Stoicism,1700734079.0,t3_181y1kb,0.57,2
help,**should i fight my bully by gathering courage and be a tougher version of myself or should i tell my teacher ( i think teacher would take action )and only focus on my JEE preparation (only 7 months left for it ) ?**,Stoicism,1688533369.0,t3_14r0qb1,0.5,0
i keep getting screwed over by friends.,"Firstly, saved up a ton of money to go to europe with a friend who after 3 days of being in France he decided he needed to go home. His decision roughly costed me 3k. After getting back to the states I planned another trip with another friend that is now a week away. Unfortunately, he just canceled on me. Now, both of these “friends” I considered to be good friends of mine so it definitely sucked to get screwed over by them especially when I don’t have that many friends. I realize that I need to be thankful for the things I do have in life such as my health, my family, my small amount of friends, and the opportunity to be better everyday but I can’t lie when I say I wish I had more friends or at least friends that don’t routinely screw me over. Any stoic advice on not having friends/low quality friends?",Stoicism,1688219024.0,t3_14nvhzl,0.5,0
Would you rather live in a perfect simulation or continue living irl ?,.,Stoicism,1683832192.0,t3_13ewtbx,0.5,0
Its so difficult to punish those who you love,"The historian Gibbon describes how the Roman emperor [Alexander Severus failed to punish his son](https://commonplaceapp.com/post/4223a918-675d-4433-bbb4-375fd4637c79), which caused massive destruction from the eventual elevation of his tyrannical offspring to the Roman royal throne. How much human misery has been caused by the failure of a parent to punish his children?",Stoicism,1678117690.0,t3_11k2e2o,0.5,0
"Not all emotions are bad, emotions can be good too","The below is part of my annotation series of ""The Emperor's Handbook"" (Meditations) on CommonPlace. See the full passage (book 8, section 4, pg. 92) by Aurelius on Commonplace [**here**](https://apple.co/3UDw3Fe)**.** *If you are interested helping annotate Meditations/stoic texts*, please post them to to the [CommonPlace Stoicism book club](https://apple.co/3UDw3Fe).

\_\_\_\_\_\_\_\_\_\_\_\_\_\_\_\_\_\_\_\_\_\_\_\_\_\_\_\_\_\_\_\_\_\_\_\_\_\_\_\_\_\_\_\_\_\_\_\_\_\_\_\_\_\_\_\_\_\_\_\_\_\_\_\_\_\_\_\_\_\_\_\_\_\_\_\_\_\_\_\_\_\_\_\_\_\_\_\_\_\_\_\_\_\_\_\_\_\_\_\_\_\_\_\_\_\_\_\_

**“You must no longer feel anger, resentment, envy, or regret,” said Epictetus.** Many stoics, such as Epictetus, seem to completely disown emotions, seeing them as irrational and therefore bad. But human emotions, having developed over millions of years for evolutionary purposes (such as the desire to eat when the body requires energy) are natural, and, as Aurelius points out, *“nothing that is according to nature can be evil.”* The problem with emotions then is not that they exist, it is that they are often not as they should be, they are not *“in accord with reason.”* Living virtuously then is not living emotionlessly but living with the correct emotions. As Aristotle said, “*some describe moral virtue as being a kind of freedom from emotion and disturbance; this is incorrect because the assertion should be qualified: they should have said moral virtue is freedom from those emotions that are not as they should be.”*

If we can discipline ourselves, train ourselves, to have emotions that are aligned with how they rationally should be, then *“emotions are not only blameless, but even praiseworthy!” (St. Augustine).* This will not be an easy task though, for *“anyone can become angry — that is easy. But to be angry with the right person, to the right degree, at the right time, for the right purpose, and in the right way — this is not easy.” (Aristotle).* 

So then, next time you feel emotion, do not immediately condemn it, but rather reflect if the emotion is as it should have been.",Stoicism,1672072125.0,t3_zvqpyp,0.5,0
Was Gandalf a stoic?,"Been watching the LOTR movies and can’t decide if Gandalf is a stoic figure or more of an eastern mystic/guru-type personality. Tolkien was certainly well versed in western philosophy, but the British empire was also entwined with India during his lifetime and many of the babas (wise old men) of that region have long grey beards and resemble wizards. Did Tolkien have Marcus Aurelius in mind or perhaps someone like Paramhansa Yogananda when developing Gandalf’s character?",Stoicism,1666119989.0,t3_y7fsfl,0.46,0
I fucked up today.,I fucked up my practice of stoicism badly and let rage take over and consume me. Should I punish myself? What I did is recoverable but I cannot allow myself to stoop this low ever again. I already prayed to God/Allah for forgiveness. What have u guys done to recover from a bad fuck up?,Stoicism,1660327637.0,t3_wmrvff,0.54,1
I am ending this life,I am gonna delete the account too,Stoicism,1655471604.0,t3_vecw5l,0.54,1
How do we exist in this moment in time? And why is nobody talking about it?,"The past few years my mind has become obsessed with finding the meaning of life. Aswell as what it means to live and die. I’ve found it’s all I’ve been thinking about lately. To the point where it’s driving me nearly insane. 

What does it mean to be alive in the current moment you are experiencing right now? Why do I not consciously exist in my dads body when he was born, or any of my ancestors before him? There is no coincidence that I exist in this exact moment in time. 

There is a purpose to all of this and nobody is talking about it. Why hasn’t civilization spent every resource into finding the meaning of life? 

Doesn’t this whole “life” thing seem a little TOO unbelievable. Something is going on.",Stoicism,1639375606.0,t3_rf8ut6,0.5,0
Can anyone share Meditations by Marcus Aurelius (Gregory Hay's translation) epub/mobi ebook with me?,,Stoicism,1626017984.0,t3_oi6prt,0.5,0
How do I get over the fact that I’m gonna start my adult life as a senior in high school,Ever since 3rd I’ve always been bitter and jaded about the fact that I’m older 95% of my classmates It’s always done a toll on my self esteem people my age are graduating and moving on to the real world while I’m gonna be stuck in a building 35 hours a week with 14-17 year olds learning about stuff that I should’ve already learned about I always felt outta place I’m tired of being behind in life,Stoicism,1620359654.0,t3_n6ppfb,0.5,0
Stoicism is almost like an early version of Christianity.,"Though I’m not exactly well versed in either Christianity or Stoic philosophy, it seems to me that at a glance the two seem to run together. What are your thoughts on this?",Stoicism,1563801265.0,t3_cgd1z4,0.5,0
"If the stoics believed in reason, how could they have believed in the gods/god? Because god is illogical (truth).",,Stoicism,1562606982.0,t3_cao1wv,0.57,2
How to make Stoicism great again?,"A few weeks ago, [a discussion started](https://www.facebook.com/groups/PhilosophieDerStoa/permalink/845568969137599/) in a Facebook-Group of the German Stoicism Community about how to make the philosophy great again. The question in the room was mainly: **How do we publicize it more?** Sawing how many interesting answers came together through that post, I was interested in what the community here on Reddit would say to that question. I'm looking forward to your answers!

&#x200B;

Note: You find the comment I posted in the discussion translated down here.",Stoicism,1557012450.0,t3_bkr6p5,0.46,0
"Should I date this girl??? (Long, sorry)","So I am talking to this girl I met from Tinder. We went on a first date and it was definitely the best first date I've been on. We'd been texting for a couple weeks before, and had to reschedule a couple times so I already had a sense of who she was and she is just really really cool. She's pretty, and I can talk to her about things I can never talk to other girls about, because she is a huge geek and very intelligent and articulate, and she is really sweet and kind of innocent-seeming, and basically I was just very comfortable around her and she basically said the date went really well and she wants to see me again, and she has started texting more since then and interacting with her just makes me happy.

HOWEVER. I'm terrible at relationships. I haven't been in many real longterm relationships. And I am not a very secure person by any means, and relationships really make me very neurotic. I get insecure, and I always think about the other person, and obsess, and while in some ways I feel much more confident, in other ways they really just kill me psychologically. I am already feeling this with this girl. I worry whenever she doesn't text back, and before we went out she kind of went AWOL for a week dealing with a friend who developed feelings for her (and she was on spring break) and it just kind of killed me and I actually started feeling better when I thought she was ghosting me and I was done. But now we have gone out and she has given clear signs that she really seems to like me, which again makes me very happy because she just seems like a really special girl, and I haven't been in a relationship in a while and it's exciting, and we're just really on the same wavelength. 

So I really don't know what to do. It's a no-brainer that I should try to date this girl. But I have attachment issues and I'm so scared of losing the few people I really connect with, especially if it's romantically. I'm scared of messing up. She is nowhere near the type of girl who would ever cheat or hurt me like that or anything, but I still worry about this in all my relationships because I've really been hurt before. I even worry about the fact that at somepoint even if things go really well, it'll end eventually and either I will get hurt, which would really suck and be regrettable, or I will hurt her, which is unacceptable.

I know that was a lot, but I wanted to articulate my feelings so maybe you guys could help give me some guidance from a Stoic point of view. I cannot tell if the ""stoic thing to do"" is to realize that this will inevitably lead to pain in some form, whether she ends up not liking me and ghosts me in a month, or we start dating and breakup in 2 years, and likely the amount of pain in the end will be proportional to the time put in............or does the modern Stoic look at this and say ""proceed virtuously, if you really like this girl, give her your all and enjoy the struggle to come to terms with the impermanence and possibility of getting hurt or losing her eventually""...?????

I know I'm overthinking a lot, but I mean I might as well",Stoicism,1553649775.0,t3_b5y77w,0.5,0
"""Momento mori"" message is stronger and more important in Abrahamic religions than in atheism.","In Abrahamic religions, especially in Christianity, after you physically die you'll face divine judgement that determines your eternal fate. In other hand, in atheistic stoicism, the ""judgement"" only happens in your friends or foes' mind - to bless good memories of you or to spit on them.",Stoicism,1549898061.0,t3_aph6xo,0.5,0
Help me.I want to know that what type of song should i listen as being stoic i hope you guys will answer,,Stoicism,1519697799.0,t3_80irig,0.5,0
I went to work out and meditate during the eclipse. I came in to this. Oscar as Yang on Blue & Mowgli as Yin on Pink.,,Stoicism,1503340550.0,t3_6v4yvy,0.47,0
Conceptual desires vs the desire for sensory pleasure. Solely for pleasure's sake.,,Stoicism,1473006543.0,t3_514oz9,0.5,0
You're not drinking enough water!,"No seriously, friends and fellow stoics. We are all here for self improvment, but you're not drinking enough water. Your brain is so thirsty, but we have ignored it for so long we can't tell. I have been on This ""water diet"" for 2 weeks now, and I feel better then I've ever felt. By water diet, I don't mean don't eat. I mean, just drink water, lots of water. I've quit sugary drinks, you don't have to do that though, just drink water. Half your body weight in water. Weigh 200 lbs? You need 100 oz of water, every day. 

Try it, your body will thank you.",Stoicism,1501464212.0,t3_6qla8g,0.61,14
How can i cure or diminish…this lustful desire. It’s been beating my ass,"It’s Sex basically, you all see posts like this every day i know. My story may be a bit different though. Before i begin i need to clarify that i’m neither a feminist nor a incel..or do i have any hatred towards anyone. I do not feel like i am entitled to a woman’s body. I do not feel entitled to anything in this world including my care i’ve gotten from my parents or even the opportunity to go to a good high school and live in good neighborhood etc etc…

20 y/o male. I live in the Southern part of the US. I work as a new car lot porter at my job at a dealership. Huge car guy, my after work…or free time I’m making artwork. Whether it’s sketching a portrait or building a full 3D car. My day consists of work -> home -> repeat. 
The thing is i’ve just recently been able to drive myself to and from work and now i have a car so i can take myself places. I used to think my lack of having a car was stopping me from getting 🐱. Turns out everyone else was right and it is an internal issue. Who knew. 
 My life seems so purposeless now though. I make artwork but no one gives a fuck. No one cares about a starving artist. People say like post on Social media and i’ve been down that road it makes me hate doing the craft itself. I feel like i have no friends at all. Well i don’t.
 I’m going through the list of things thats really on my mind right now. The main thing is of course Sex. 
 Its been exactly a year since i was in my first/last relationship. Ironically she actually had hmu a few days ago. I was excited of course but she got very flakey and i just stopped giving my attention and energy away. To be honest seeing her message took me through a lot of emotions. It’s one of the reasons i’m trying so hard to find a “rebound” We didn’t talk much when we reconnected. Just some texts about how i finally got my vehicle and my new job. When we were dating i worked retail and couldn’t afford a car. I offered to take her out since i now could do more for her. But she said “no thanks” so she’s probably with someone else or idk. Half of me wishes she never had checked up on me. First heartbreaks are always the worst. I took the high road and said i appreciate her reaching out and checking up on me.
I know this is all over the place but bear with me. There’s definitely some women at my job i look at and seen look back at me. Never say anything though. I don’t know how i should do this. There’s like these weird energies or vibes i feel when i pass certain women. Some good some bad. Some really good. I seem to come up with the smoothest game plan and lines in my head. But when i get the opportunity i freeze up.
Ok I need to also mention i’m on nofap…1 1/2 weeks. I do 50 pushups daily. My GM mentioned that he noticed i was working out. So i don’t know if it’s noticeable to the women or not. I always ask myself what are they thinking about me. 
Before you say dating at a job is bad….i am required to talk to 0 people daily…i’m outside all day (others are in) It’s to the point i’m always questioned if i work there since i don’t where a sales or service uniform. Every other employee does but me. Actually there are other examples but you get my point. 
I know rejection can happen…it’s just the uncertainty how. Also the choosing signals i get i always try to assume its them being nice. Maybe it is. 

Much to unwrap here.",Stoicism,1694485812.0,t3_16gf7bv,0.41,0
"To be successful on stoic path, you should devote yourself fully to philosophy","Every moment of your life should be reflected through stoic lenses, every thought that you acquired should be tested by virtues, every action that you take should be aligned with human and cosmic nature. 
Don’t wake up without thoughts about virtue and don’t go to sleep without reflection on the past day. Don’t eat without temperance, don’t talk without justice, don’t act without wisdom in our mind. 
It’s sounds like a religious faith, but it’s not. You don’t need to be ritualistic about it, you need to be persistent. 
It’s sounds like a obsession, but it’s not.  You can’t desire virtue without moderation of your desire. 
It’s sounds like a restriction to life itself, but it’s not. You choosing life itself, not external things, because life it’s an internal process of purification and growth. 
Choosing the right thing every second of your life, because you chose stoicism in the past, because you want to be happy and free.",Stoicism,1631189150.0,t3_pkwh58,0.6,11
