title,selftext,subreddit,created_utc,name,upvote ratio,num_upvotes
Is Stoicism becoming too trendy?,"One of the criticisms I've seen popping up periodically on social networks is that Stoicism is becoming ""too trendy"".  Someone tweeted a comment along those lines today that reminded me of this.  What do you think?  Should we be concerned?  Could Stoicism become a victim of its own success?  The Stoicism Today team, of which I'm a member, have been promoting discussion of ancient Stoicism for the past three or four years, through Stoic Week and other events.  So maybe we're partly to blame.  What do you think might be the pros and cons of popularising the study of ancient Stoicism and exploring its application to modern living?",Stoicism,1445898978.0,t3_3qcboh,0.54,2
[Just a view from above] 'What if the Moon was a Disco Ball?',,Stoicism,1444474375.0,t3_3o7gsg,0.59,3
"A prayer I found in the book 'Slaughterhouse 5', thought it belonged here","GOD GRANT ME
THE SERENITY TO ACCEPT
THE THINGS I CANNOT CHANGE,
COURAGE
TO CHANGE THE THINGS I CAN
AND WISDOM ALWAYS
TO TELL THE 
DIFFERENCE.",Stoicism,1407342228.0,t3_2csrr4,0.52,1
How do I not care about offensive jokes people make in uni?,"(21 F) It’s my first year in uni and I would say I’m a really social person.

So I met this one guy who was with a girl and they’re both really friendly. This guy and I come from the same country in North Africa and have been making a lot of jokes at each other in a light manner until until he started going after my appearance by saying my forehead was big and saying I have “googly eyes” (for wearing glasses) even though we both wear glasses and have big foreheads. I just laughed it off but him and the girl could tell I was affected by it so they said I was laughing in pain and he apologized. I told him I didn’t care and he was like “the insults I just told you were the tip of the ice berg, I could go more but I won’t do that” I could’ve insulted him for having acne but I’m not that type of person. 

I really want to learn how to stop taking these jokes seriously especially targeted at appearance but I don’t know how. I want to learn how to at least hide the fact that I am upset, I don’t like showing weaknesses. I’ve been following stoicism for long while now and it has helped me a lot with dealing family trauma, I thought I’d be numb to insults but I guess not.",Stoicism,1694003451.0,t3_16bj0l3,0.56,2
If I Try to flex but I dont do it is still stoicism?,Basically we got in an argument and I was about to flex money and shit but I didnt do it. Is this still stoicism or shouldnt even cross my mind to be consider stoic? and how can I avoid this vague and mundane thoughts to cross my mind?,Stoicism,1693054927.0,t3_161unng,0.44,0
Can anyone be stoic?,"3 months since interest in stoicism, but I am not a better person I imagined I will be.

It appears I don't understand it.

I hear that you should control your emotions, but I can not, I still yell, shout, swear people out.

I get angry at things than only later I realise I shouldn't.

Still don't understand about helping people, should I do good favours for people I hate and those who don't return the favour?

Be nice to people that I don't like?

Should I ignore people I don't want to talk to?

How drastically should I interpret qoutes about not choosing expensive things?

Am I not understanding stoicism correctly?

Maybe to young to be a stoic(15)

Can anyone be a stoic?

Can you recommend me books, YouTube channels or whatever to be a better stoic

Sorry for disturbing and bad english.
Thank you.",Stoicism,1692304303.0,t3_15tytil,0.56,2
"I asked a child named luca ""why are you luca?"" and his response was interesting","""I am luca because I went shopping with my dad and he called me luca""

And i believe your identity is defined by what you do and not what you think you are",Stoicism,1689691002.0,t3_15307yc,0.44,0
Stoicism is not an excuse to cover up cowardice.,"Courage is the first and greatest virtue. Next is gratitude.

Please don't be a coward and say you're being stoic.",Stoicism,1668099633.0,t3_yrl3fx,0.44,0
"when I practice Stoicism, will I still enjoy movies?",Question just popped out of nowhere. Because I feel like I'll rationalize the problems and deaths in a show.,Stoicism,1654618851.0,t3_v709sr,0.41,0
Sexual history,"What are stoicism’s thoughts on judging a partner on his or her sexual history. 

My friends with benefits relationship has turned to a committed relationship as of recently. 

I recognise this relationship has comparatively poor foundation since till some time it has been based on pure physical intimacy. 

But we have fallen in love and I feel the change in our relationship from just lust to lust and love. 

I am however concerned with her sexual past. 

She has had one fling in the past which is bothering me.

She had this fling to get over me since i had a fling too, i was an asshole to her which i have changed since then.

The reason it’s bothering me are the following . 

I will dive deep and be completely honest about what they are.

I am afraid as she has done it once she might cheat on me.


It’s an irrational thought but it is there. 

I guess it has to do with my upbringing and beliefs. 

I am actively trying to challenge this feeling so that it is replaced or atleast accompanied by another realistic one. 

She has not cheated on her one bf she had. 

It is my insecurity and has nothing to do with her but still I genuinely fear that a girl with a history of fling is a risk. 

My lack of sexual experience might have to do something with this insecurity 

It would help to surround myself with some open minded people but sadly people around here don’t talk much about this stuff since it’s considered a taboo to talk about sex. Therefore I feel alone in feeling this , like I am the only one having these doubts and thoughts.

Can any of you stoics relate to this?",Stoicism,1653802878.0,t3_v04n40,0.56,2
Being unfollowed on social media,I get worked up when someone unfollows me on social media. Usually it’s acquaintances or people who I just know on the socials and not in real life. I usually say Iv not done anything to them-why would they unfollow. Also I care about other peoples opinion on me esp family. I usually overthink myself to death.I need the intervention of stoicism.,Stoicism,1633101774.0,t3_pza97d,0.44,0
Would Stoic kill Hitler?,"I know the title is a bit controversial, so let me explain.

We believe there are no bad or good people, just those who follow Nature and those who do things on external influences and bad judgments, thus not following Nature and not fulfilling their potential. 

Killing someone is also not a very Stoic thing *per se* \- how can taking someone's life make me virtuous? And if I believe there are no bad or good people with killing someone (that would outside of Stoic circles be considered ""bad"") I essentially stop that person from potentially fulfilling their potential and giving up bad judgments, and aligning himself with Nature.

BUT - then again what greatly differentiates Stoic from Sceptic is that we believe we must do things that are not only making us virtuous but also making our surroundings a better place. We don't run from society, we want to make society as a whole a better place.

&#x200B;

So that brings me to Hitler part - is it a Stoic way to kill someone that is affecting the lives of so many people, whose bad judgments are resulting in the death of other people and thus his actions are essentially preventing others (in this case millions) from following their Nature, their Virtue (being taking their lives, or affecting someone who finds no virtue in killing someone in a way that he must join the army and kill other men that he have no reason to). 

On one hand, is it not in my power to decide how and what some dictator will do, but on the other hand, if there was an opportunity for me to end the suffering of society and millions of people by killing a dictator then making society a better place IS IN THAT CASE IN MY POWER.

Interested to read some insights on this.",Stoicism,1630593909.0,t3_pgjb4f,0.59,3
Excuses are the crutches of the untalented and unambitious.,,Stoicism,1573870346.0,t3_dx0qgf,0.44,0
This girl i was having a love relationship got back with her ex today.,"I, felt anger and dissapointment, i was about to cry but suddently. A dead expression appeared in  my face and i stopped feeling anything but calmness.

This time, i know for sure, 
   I have become a stoic man.",Stoicism,1555982668.0,t3_bga7t2,0.56,2
Jeff Bezos and Stoicism,,Stoicism,1537421822.0,t3_9hcnuh,0.47,0
Jordan Peterson and the return of the Stoics,,Stoicism,1524954751.0,t3_8fna20,0.43,0
"Ryan Holiday, curious what you think about him","Hi all, hope you all had a good week. I'm curious about Ryan. I think he's done a great service in reintroducing the lost philosophy of stoicism (at least for me). One thing I'm having a hard time with is who he uses as references in his books. He uses Elizabeth Warren and Hillary Clinton.  I don't know why he does this and why he uses them as role models. It really makes me question Ryan as a person and his motives.  What about you?",Stoicism,1521257650.0,t3_8518em,0.56,2
Why Stoicism is The GREATEST Mind-Hack ever Devised,,Stoicism,1504378840.0,t3_6xo5lu,0.52,1
"I recently started getting close to a girl and I cannot for the life of me accept that they actually enjoy my presence and wanna be around me. I am not forcing ANYTHING, she almost always initiates and I still feel so insecure and in disbelief","Theres this girl I've been getting closer with for the past few months. I thought I saw signs but wasn't sure.

Its so hard to believe that someone actually likes me. She invites me to a bunch of events, shes always trying to talk to me and like tease/flirts around. She buys me things.

I feel so much positive energy around her but my fucking brain is like ""hehe are you sure about that"" and I clam up. I can barely speak. When I do speak my voice is deeper because my vocal cords are literally strained. My mind goes blank. My neck fucking tenses up.

Shes asked so many questions about my personal life but I cant open up. I try but just shut down and move on to something else.

She tells me about her personal life but even then I struggle to follow along cuz im too worried about looking interested and my fucking face gets tired and sore.

Shes so freidnly to me. I genuiomly dont understand how she still deals with me. I'd imagine its so annoying. I go home every day thinking I fucked everything up. All my speaking was wrong, all my reactions were wrong, all my emotions were wrong. It feels like im a social train wreck. But from what I can tell the ""relationship"" only grows stronger with each day and interaction.

It doesn't make any sense. Ai judge and criticize myself and truly feel I miss every interaction we get. But she keeps acting flirty, keeps inviting me to do things, keeps interacting with me.

What the fuck is wrong with me?",Stoicism,1697093324.0,t3_1760i2k,0.61,6
Death of a stoic,"Ok so she wasn’t actually a Stoic, but if you want an example of profound dedication to her role and unflinching adherence to her duty as she saw it, the Queen’s a pretty tough one to beat. 

RIP ma’am.",Stoicism,1662664505.0,t3_x98w4i,0.39,0
How do i deal with this type of rejection?,"Hey,

So here it is. I told her that i love her. How much i love her and all this crap, and she returned it. We were texting more lovey dovey crap than i did with my last girlfriend. Thing is, i didnt ask her out yet then. I told her how much i care about her, how much she means to me…She told me that i made her the happiest woman alive..That she loves me more than anything…And how much she loves me. We were texting every day…Telling eachother how much we love eachother. Every time i said that i love her more, she always reassured me that she does love me more.
Every day we texted, met up, even kissed… all this for 1 and a half year. She always told me how much she loved and missed me while i was at work…Called me baby…and so here it comes. When i told her if she wants to be my girlfriend..She said that she didn’t know i view her that way. That i love her that way. She said that she thinks she does not love me the way i love her…That she viewed me as a friend the entire time…But that she meant everything she said? Then told me that this is why she cant get guy friends? It happened multiple times and…This? Im really down. I really dont know what to think, i tried talking to her after but she is ignoring me telling me that she wont talk to me in that state. Now im here alone.
How do i deal with this?

Thank you in Advance!",Stoicism,1690572816.0,t3_15c6vrc,0.6,4
The Ten Equations That Rule The World,"I just finished fascinating audiobook called ""The Ten Equations That Rule The World"" by David Sumpter, and I wanted to share it with you all. While it may not be directly related to Stoicism, I found some interesting parallels between the mathematical principles discussed in the book and our Stoic philosophy.

Stoicism teaches us to cultivate virtues like wisdom, courage, justice, and temperance, enabling us to navigate life's challenges and achieve inner peace. Similarly, this book explores ten equations that provide mathematical frameworks for understanding different aspects of our world.

By delving into these equations, the author sheds light on fundamental principles that govern areas such as economics, population dynamics, quantum mechanics, and more. While this may seem far from our usual Stoic discussions, I found that the analytical and systematic approach presented in the book resonated with our philosophy.

Stoicism encourages critical thinking, self-reflection, and the pursuit of knowledge. ""The Ten Equations That Rule The World"" offers a similar intellectual journey, inviting us to explore the underlying truths and patterns that shape our reality.

By engaging with these mathematical concepts, we can sharpen our analytical skills, expand our understanding of the world, and develop a deeper appreciation for the interconnectedness of all things – a perspective that aligns with Stoic principles.

So, if you're interested in exploring the intersection of mathematics, science, and philosophy, I highly recommend giving ""The Ten Equations That Rule The World"" a read. It's an enlightening journey that may provide fresh insights and complement our Stoic practices.

Stay curious and keep cultivating those virtues, my fellow Stoics!",Stoicism,1684458449.0,t3_13lgo29,0.57,3
I fumbled a 10/10,"My story is tragic, I just can't get over it. Let me tell you. There's this girl at school and I've had a crush on her for 2 years now. For 1 year, I tried to exchange some glances with her, passing by her in the hallways and finding her extremely beautiful. She never looked at me, it seemed like she didn't notice me. 

I have a certain amount of self-esteem and I don't want to force anything anyway, so I tried to forget about her. So after the first whole year of trying to exchange glances, I finally stopped and for another year, I moved on and almost forgot about her. However, a month ago, I don't know why or how, but she started looking at me with what seemed like passion, every day. 

At first, I thought I was imagining it and didn't pay her any attention, but it became more and more obvious. Nevertheless, I decided not to do anything, so I didn't go talk to her, but one day we took the same bus and she just stared at me the whole way. When I got off the bus, I started walking towards my house, and then I heard footsteps behind me and felt a tap on my shoulder. I turned around and it was the girl in question. She literally asked me for my number. I couldn't believe it, so I acted in probably the worst way a human being can react. 

I had my headphones on and pretended not to hear her. I just continued on my way without even responding to her or looking her in the eye, even though she had the courage to come up to me, a courage that I never had. I don't know how she took it, but I really messed up. I was scared, and that fear betrayed me. Maybe I deserve it, probably. What's really sad is that for some external reason, maybe for professional or family reasons, I don't know, she left school a week ago. 

I probably will never see her again. I still remember when she asked me for my number, she was really the most beautiful girl I've ever seen in my life, she had a smile, she was gentle, and I didn't do anything, nothing. Whatever anyone might say, I will live with the doubt, from time to time, I will remember that moment, I will think about it late at night, and what if I had acted?",Stoicism,1680124618.0,t3_1260znm,0.58,3
How does modern physics fit in stoicism?,The title says all,Stoicism,1679670520.0,t3_120n62x,0.45,0
Perception,"Have you seen the clip of a woman disappearing behind Scarlett Johansson?

The woman doesn’t disappear. I took a screen shot of the clip. The circle is the cloth of the woman’s dress splaying past Johansson’s arm.

In my personal dictionary, this clip is the definition of ‘Perception’. Let’s throw out the idea the video is edited. I’m taking to a bigger idea.

The camera’s angle creates the illusion. Your viewpoint is REALLY important. Your current location is the the only way you know how to see and experience life.

Stoicism helps me see reality from a very intimate and personal viewpoint. It’s a
tool that locks my camera’s angle in place.

I don’t expect you to agree, because I can’t control that. Treat everyone, everyday with patience and understanding. Don’t expect it back in return.",Stoicism,1671257130.0,t3_znznvb,0.45,0
You wasn’t a stoic before you learned about stoicism,"Like you wasn’t a reader before learned how to read, you wasn’t a musician. before you learned how to play and so on. 
It’s an important thing, I think, because stoic path it’s a conscious choice to do conscious virtuous choices.",Stoicism,1632385981.0,t3_ptqtpr,0.42,0
"When it comes to acceptance, do you think this will alleviate my suffering? When it comes to my ex.","I had to let her go because I emotionally abused her, I really loved her which is why I was never afraid to let her go. I still get intrusive thoughts about her but maybe it was me not acknowledging that she was perfect just the way she is? Anyways, I know she will never give me another chance and I could careless because I taught her things that no other guy in the world did about love and happiness.


Love isn't about possessions but freedom and it is the spirit of giving, I never wanted to possess her and I'm trying to let her go everyday. It may not be easy but is there anyway for me to make it easier? I keep telling myself that she has flaws whether it was her trying to make me jealous(caused by myself) or her hanging out with other guys(she told me it was innocent and I just wanted to believe that is the case).",Stoicism,1613446098.0,t3_lkuot6,0.52,1
Is Zen better than Stoicism?,"From what I’ve gathered, Zen is about the limits of rational thought and enlightenment. What are your thoughts on Zen vs Stoicism? 

**Personally, I’ve found practicing Zen to be a much better, richer, more satisfying experience than practicing Stoicism**",Stoicism,1611420729.0,t3_l3fogi,0.57,3
Why stoicism is Stupid by Scott Perry,[stoicism is Stupid](https://medium.com/stoicism-philosophy-as-a-way-of-life/stoicism-is-stupid-8c90bd1ff1e9?source=friends_link&sk=a108f7cb007ae3861581c1498b73b3f2),Stoicism,1571672047.0,t3_dl28tw,0.45,0
God’s Love & Meaningful Suffering,"The two main points of life are to love and to suffer. This is symbolic in Jesus’s journey. 

Jesus loved us in a way that only God could. Jesus suffered for us in a way that only God could. Jesus conquered death. The wage of sin is death. Jesus conquered sin. His suffering allowed God’s Love, the blood of Christ, to wash over us. 

Suffering is inevitable on earth. Living by sin leads to empty &amp;amp; meaningless suffering. God’s love is the only true salvation from this suffering. Though we will still suffer, internalizing his love is all we need to fully love &amp;amp; accept ourselves and our situations. When that happens, the acceptance and love shines like a light for others. 

No short term desires compare to a relationship with God. It’s not about being perfect. The right things do themselves when fully conscious of God’s love and presence. Even if the right thing causes more suffering, God’s love will triumph over any suffering as you surrender to a full consciousness of him. Why turn from him and suffer meaninglessly on your own selfish accord?",Stoicism,1530255743.0,t3_8ur4pv,0.46,0
"Nope, Jordan Peterson ain’t no Stoic",,Stoicism,1528088326.0,t3_8oepw3,0.48,0
"""If you are unhappy, it is your fault"" - I made a community where you can practice optimism","> **If you are unhappy, it is your fault**

> You and only you can make you happy. Other people and other things cannot make you happy, but you can find happiness through their medium. Wood does not make one happy, but cutting, sanding, and assembling wood into a piece of art or furniture can bring happiness through the actions you take with it. Inversely, you cannot, and should not expect to, make others happy. It is their responsibility to find happiness through the actions they take with you.

When it comes to practice, this is far from easy. 

So I made a community/online space where I and others can practice optimism to fasten the change in our perspective.



Invitation: https://discord.gg/SH69A8K 
 
Once you join the discord server, please read #information to see if it will benefit you. In total it takes like 20 seconds to join, look around and leave.",Stoicism,1519822045.0,t3_80vryb,0.6,5
Stoicism: Silicon Valley tech workers are reading Ryan Holiday to use an ancient philosophy as a life hack,,Stoicism,1482022458.0,t3_5ixphu,0.58,4
Actions against terrorism.,"So terrorism is caused largely, nowadays by Islamic extremists. Cato of Utica took up arms against Caesar because he felt that having Caesar in power would be detrimental to the freedom of Rome.
Marcus Aurelius conducted numerous military campaigns in old Europe. Even Socrates was a war hero before he became the father of western philosophy.

Serious question now; Should we do the same?
Islamic extremists threatens the stability of the western civilization. They knowingly and tactically use our freedoms against us. 

I believe as stoics dedicated to a cosmopolitan world, we are tasked with doing all in our power to change this (if nothing else prevents us) although of course, we should be indifferent to the outcome (death, exile, torture etc). Either that, or we should merge the collapse of western civilization and our own painful deaths into our personal premeditation of adversity practices.

Any thoughts?",Stoicism,1474227412.0,t3_53dr1o,0.45,0
"Practical stoicism or humour? - ""How The Stoics Got Laid: 5 Lessons On Meeting Women""",,Stoicism,1369118185.0,t3_1er13j,0.62,5
How would a stoic stop pineing over a Woman?,"
I saught friendship with a virtous woman, but the admiration turned into affection. She is spoken for and although she is - I wanted to tell her my feelings for I felt to deprive someone of choice is not right. My choice was to give her the power. I made it clear, that if she should what I would call a 'negative result' then I would do everything in my power to keep our relationship the same: friends. (Because I truly respect this woman.)I want her to feel guilt free and, if possible flattered by my affection. This I achieved - I believe. But now, I have confessed, and unfortunately said negative result has arrived I need help on thworting how I pine for her, at least physically. She's really beautiful and it's hard to not see her like that. I want to act with virtue and be the friend that she wants. But the pain is real. Do I just have to suck it up or do is there some wisdom here to help me through my choices? 

Thank you.",Stoicism,1705234046.0,t3_196eh6s,0.41,0
"Women are not capable of ""extreme leadership"" due to being ""more emotional and irrational""? I find this questionable.","[https://youtube.com/shorts/XzB8nqFM61g?feature=share](https://youtube.com/shorts/XzB8nqFM61g?feature=share)

I came across this, watched it out of morbid curiosity, and found it baffling. I also argued with one commenter about famous female leaders. In short (and from what I can remember), he argued about how the most beloved either defaulted to their ruling husbands; single rulers not striving for proper successors; and those such as Margaret Thatcher waging war on sovereign nations over small gains. He also spouted that female brains cannot overcome the innate differences they have from men such as being ""more prone to shouting and crying"".

I argued that many women are capable of controlling their emotions (in fact, the image I have seen with associated with mature femininity is a sagely and dignified lady no matter how tense a situation is) and that countless male rulers were/are just as guilty of petty and immature deeds. (And what I find richly ironic is that the commenter said he was from Russia, where the women there are ""more mature than American women but still pale to Russian men"". Meanwhile, his male ruler is waging war that he's struggling with but is too stubborn to cut his losses)

I just don't get where people get the idea of women being less emotionally stable and incapable of leading in tense situations.

I apologize for this odd post. I just wanted to share and get insight on this matter.

&#x200B;",Stoicism,1688779942.0,t3_14tpx6c,0.41,0
