title,selftext,subreddit,created_utc,name,upvote ratio,num_upvotes
"I have cheated and now I'm heartbroken, in need of stoic guidance","I cheated on my ex-girlfriend (Whom I'm still close with) whilst we were in a committed relationship and she found out now she never wants to see me again, breaking my heart.  I never told her and hid it because I was too ashamed, insecure and afraid of the consequence. I have lost a person who I deeply cared about and likely also a lot of our coming friends. 

I have betrayed my own morals and principles. I don't know what to do now and feel really lost. 

&#x200B;

&#x200B;

Update: 

 
Thanks to everyone who provided me with advice, I appreciate it dearly.

I'm not looking for empathy pity or salvation. I'm well aware of facing the consequences of my actions. Not only have I lost somebody who I deeply care about, I have also hurt her in a way that may effect the rest of her life. That's where the pain truly comes from and it shook me to my core.

I'm here because I'm lost and broken. I am looking for rebuild myself from the ground up and and get on the right part. I just don't know where to start.",Stoicism,1690656287.0,t3_15czm6z,0.49,0
"Female/POC Stoics, are there any?","Great philosophy is great, regardless of the source—bug I find myself wondering why stoicism often lives in the sphere of the “white male”, even in contemporary examples. I believe it’s a great school of thought and would be curious if anyone has sources that extend beyond the typical eurocentric/androcentric perspectives that are often lauded in stoic philosophy.",Stoicism,1650821088.0,t3_uazmqr,0.51,2
Marty Byrde from Netflix show Ozark is a quintessential Stoic,"If someone saw the show, you know exactly what I'm talking about. 
I highly suggest you watch it because its really good",Stoicism,1652788114.0,t3_urkmqz,0.53,12
I am affected by what is currently happening in Gaza.,"I feel like nothing makes any sense anymore. How can people sleep comfortably knowing that their fellow human beings are experiencing genocide and children and innocent people are being killed? I feel guilty for having the privilege and resources to achieve my goals, for being able to buy meals, for having a roof over my head. I feel guilty about living. I am so sad for the people suffering and it's out of my control.

**\*\*\*READ THIS\*\*\***

Just because I specifically mentioned Gaza doesn't mean I am not compassionate toward other races and countries too. What is wrong with some of you? I pity both the innocent people of Israel and Palestine. I am also saddened by what has happened in both Ukraine and Russia. I HAVE EMPATHY FOR ALL HUMAN KINDS AND RACES. Why are you all assuming the other way? I DESPISE ALL FORMS OF EVIL. I am not siding with any side; I am against the people who are in charge behind all of this cruelty and those who support these actions.

Just because something worse happened in other countries doesn't mean we shouldn't stand up for other countries too. I don't know wtf happened to compassion. Why can't we all just be fvcking kind.

Here's what's currently happening in Gaza:

[https://www.instagram.com/p/C0kkXwrtoTn/?img\_index=1](https://www.instagram.com/p/C0kkXwrtoTn/?img_index=1)

[https://www.instagram.com/shaunking/](https://www.instagram.com/shaunking/)",Stoicism,1702101500.0,t3_18e6wg1,0.44,0
i'm starting to believe that stoicism doesn't really work.,"i'm not here to hate on people that say it works for them but i'm reading currently the daily stoic and it says that you should know what's in your control and what's not in your and you should accept the things that are out of your control.

but here me out things sounds great on paper but today when shit hit the fan i couldn't say oh this is out of my control and i should accept it and move on. it didn't work like this for me, i thought about it i  even slept without eating, i couldn't put what i read to practice.

and secondly if i have emotions about something outside of my control should i not process them should i just say it's out of my control and that's it?.",Stoicism,1696289319.0,t3_16yc42q,0.51,2
What does stoicism say on masturbation?,"On one hand, masturbation is healthy, but on the other hand I can see stoicism oppose it. (I'm not talking about hours upon hours of watching porn, I mean masturbation without any sort of outer connection)",Stoicism,1679506593.0,t3_11yqccy,0.51,1
"If you a stoic, why you post photo of books that you bought? What are you, a sheep that show eaten grass instead of growed wool?",,Stoicism,1556400586.0,t3_bi3ula,0.49,0
Who here is vegan or has considered it?,"Since the stoics talk about pursuing virtue, we cannot argue that the consumption of a sentient being is right.",Stoicism,1628776769.0,t3_p30e8l,0.59,97
UPDATE: Stoics are too passive,"After reading the responses on the last post, I remain resolute in my conclusion that modern practitioners of stoicism are too passive. Passiveness / pacifism are not good and virtuous in and of themselves. In the comments people were saying I had a misunderstanding of Stoicism  and how it is not pacifism per se, I agree and explain this distinction below, and that I have not read the stoics. I disagree, I have read Aurelius, Seneca, and Epictetus (the latter of which is my favorite).

&#x200B;

Don't behave cowardly and be passive and put up with it because it is cowardice masquerading as virtue. Defend your honor. There was a time when men of the past understood this idea and even dueled and put their life on the line in order to defend their honor. I am NOT saying that we go back to dueling or escalate to violence, only using that example to indicate that once upon a time men were courageous and masculine and would be willing to fight to defend their honor. To those who are going to misconstrue everything I have said, here are my basic claims so you dont put words in my mouth: 

1) Stoicism is fantastic for dealing with life events out of your control eg getting let go from your work, getting broken up with, dealing with an infirmity etc.

2) Stoicism is not fantastic for social life events in your control that require action. In practice, stoicism is very close to pacifism by modern practitioners of stoicism. This is because stoicism in some sense emasculates you because you wont have the proper masculine aggression that is needed in situations like defending your honor when you're getting bullied, teased, ridiculed, having your gf getting harassed by men, youre out with your mom and someone touches her etc, your inaction would be the result of your calm rational stoic principles that would be absolutely useless here.  When your kid is getting bullied, what do you tell them? Son be stoic and let the bullies take your money, hit you, deride you and be effectively labeled the biggest wimp in the school because as long as you have virtuous thoughts that all that matters little man. 

I am aware that stoicism is not pacifism. Dont misrepresent me. I understand Aurelius was an emperor of rome who led battles against germanic tribes. Only that in practice, modern adherents of stoicism would not encourage aggression or standing up for yourself and your honor/ your gf / your mother etc in the false name of virtue and letting things be and not allowing aggression get to you bc we're stoics and we should not let emotions get to us and we should be rational. However it is clear that this approach does not work in these social situations and not taking action is extremely cowardly.

3) I am not saying go guns blazing with violence or 10/10 aggression, only that you have the tools of aggression, potential for violence, a willingness for confrontration etc and use them judiciously in amounts that fit the situation should you be presented with a circumstance like above.

The bottom line: stoicism is not a one size fits all bandage for all your problems. When stoicism is helpful: for things out of your control like a break up, an illness, kid got into a car accident, staying calm and composed in these situations is extremely good and honorable.

When stoicism is bad: when guys are touching / flirting with your girlfriend and youre standing there idly and meekly because your stoic beliefs have hindered your aggression. Your kid is being bullied, youre out with your mom and someone touches her etc. I am not saying you beat them to a pulp, use rational judgment when deciding how much force, aggression, and potential violence is needed to end the situation without being a coward, yet avoid the other extreme of being a volatile angry mad man who wants to fight anyone who looks at you funny.

&#x200B;

What are your thoughts? I love stoicism. Please engage in good faith discussion, I am willing to learn from everyone's point of view. Thanks.",Stoicism,1628753368.0,t3_p2uzlt,0.49,0
John McCain's Stoic Christian Philosophy,"""In captivity, McCain urged his fellow prisoners not to pray for their release or their own personal success.

That stayed with him. ""**I pray to do the right thing so I won't look back in regret or embarrassment or even shame that I betrayed my principles and my faith**,"" he told me in 2008.""

Source: [""How McCain's faith sustained him""](https://edition.cnn.com/2018/08/30/politics/mccain-faith-service/)

​

Rest In Peace, Sir",Stoicism,1535621519.0,t3_9bi4x4,0.53,6
What would the stoics have thought about eating animals in modern day?,"After reading meditations, it's clear that Marcus Aurelius was focused on living within his own nature as a human being, and valued the humans ability to reason above everything.

On one hand, eating meat is human nature, we are clearly omnivores and have eaten meat as a species for as long as we've been around. 
However in modern day, eating meat isn't a requirement to live a healthy life, and the mass production of meat is widely thought to be inefficient and cruel, so using reason and the information we have available, eating meat wouldn't be the virtuous choice.

I've just been thinking about this lately, and thought there was a bit of a clash between our nature and our ability to reason in this area. There's probably more stuff like this as the modern world is so different to what was going on back when Marcus was knocking about.",Stoicism,1702292647.0,t3_18fs32u,0.53,5
Would Socrates and Epictetus have considered podcasters like Joe Rogan to be modern Sophists?,,Stoicism,1652344689.0,t3_unwgpg,0.54,6
Is stoicism a “whiteman’s doctrine?,"I would like to first start off apologizing by the provocative title. I, being a “black” stoic who debates the woke black conscious community (Afrocentrics, Hoteps/Egyptologists and Black Hebrew Israelites, etc) and they tell me that I’m indoctrinated with a whiteman’s doctrine.  I wanted to share a random fact that the founder of Stoicism Zeno was actually black. This of course isn’t to make it woke because it does NOT matter what he looked like, but Diogenes in his work Life and Times of Imminent Philosophers tells us that Zeno the Phonecian from Cyprus was a swarthy man “hence he was called the Egyptian vine-branch”.  Zeno after being shipwrecked in Athens started reading the works of Socrates(Plato) and subsequently founded the school of Zenoism/Stoicism.  People may ask what is my point and it is simply me venting. I get picked on by woke black people for my deep affection of Ancient Greek work and because they are woke, they are ignorant of the fact that Zeno was actually black. While I wasn’t physically shipwrecked in Athens, my journey began once I started studying Plato and I can tell how Zeno was able to cultivate this wonderful philosophy.",Stoicism,1689092227.0,t3_14wvqzm,0.52,3
Struggling with sexual desire and buying sex,"Although sex is a normal thing, as a single virgin 28M am struggling with it. Ideal solution would be to have a stable relationship with someone, and i can do it if i pursue. But i come from a conservative background where my parents won't accept it. I have been seeing a few woman online chat/call upon their recommendation, but i live in abroad (in a more liberal society), so the communication gap with the other people matters a lot. I have been away from my family over 5 years. I do need physical affection and love and hug in this single life (friends are not enough). I don't see myself getting married soon, and i have been seriously considering buying instead of wasting my 20s youth time just like that. Can’t deny that this sex drive may have affected my work. Ethically i am against porn and trafficking. But i am not sure what would be of me if i buy sex. In the end, i don't think i will find any open-minded woman who will accept my ""past sex-buying"" experience. 

&#x200B;

I think male sex drive is uniquely high. We can disregard it focusing on productive works, but that never vanishes the urge. The urge is like a pitfall, you will fall to it naturally if you roam near it, if the atmosphere provokes yourself. Then how do i confront this hidden energy? Whether i accept myself or obtain strategies to be blind to the sex drive- that's what i wonder.",Stoicism,1701645800.0,t3_18a6gcx,0.47,0
I’ve achieved everything I want at 35 – and I feel life is pointless. Can anyone relate?,"First of all, I do understand that this is an insane luxury problem to have. But nevertheless, a problem.

I’ve achieved and experienced literally everything I can imagine in life.

I have a net worth close to 7 M USD after selling my company a few years ago. I have excelled in school and have a master degree. I have traveled literally the whole world. I have had a ton of fun and partied a lot. I have dated a ton of women. I have a stable and great girlfriend for many years. I have a nice house and a nice car. I’m in great shape and live healthy. I have fantastic friends and family.

Objectively, I should be happy. But I am not. For the past 15 years I’ve constantly been pushing the boundaries to achieve and experience more. And now I feel like there’s nothing that ever makes me excited or feel alive anymore.

I am having a fairly normal life. I do trips. Spend time with family and girlfriend. I have started to work on a new company.

But everything feels pointless. Nothing really makes me excited. Nothing makes me feel alive. The few times I feel excited is when I have sex with my girlfriend, and I am starting to feel that it's slowly becoming a sex addiction as it's the only time I still can feel alive.

I used to have big dreams and work toward everything I wanted to achieve and experience. Now it feels like I’ve already done it all, and everything just feels empty.

I don’t feel depressed, just apathy.

It’s so hard for me to talk about it with friends as no one really can relate to it.

Can anyone here relate?",Stoicism,1677572142.0,t3_11e0pon,0.54,7
CBT is highly overrated in this sub,"I mean, with all respect, cognitive based therapies are perfect for some people with some problems, but I get feeling that CBT is almost idolized by some stoics in this sub, just because there is a debatable connection, between modern cognitive psychology and ancient texts. 
I am psychologist with interest in emotion/body based therapies, I respect psychotherapist with more cognitive approach, but honestly, it’s not a deep psychotherapy when you just scratch cognitive surface in situations where emotions/relationship involved.  
And very often sub stoics, just indoctrinate everyone and everybody, about “scientifically based, modern approach” even when OP asking about advice in family situation. 
And it’s a nightmare. 
“You have a narcissistic partner? CBT!” 
“You feel like you don’t deserve love? CBT!”
It’s reminds me of situation with my distant friend. She has highly controlling mother who interfering with  her life even after separation and induce anxiety, fear, self doubt in her. And CBT psychologist instead of exploring that connection with her mother, just gave her home task to make a list of every trigger that she have.
And she made it. And then remade it. And again and again in fear that she forgets something.
Moral of this post is:
Don’t preach if it’s not connected with your personal experience.",Stoicism,1643363694.0,t3_sen9jb,0.59,41
Ta da and farewell,"Dear Stoic Community,

I hope this message finds you all in good health and high spirits. I am writing to inform you that I have decided to step away from the Stoicism subreddit for the time being. While this community has been a source of inspiration and learning for me, I have noticed an increasing number of posts that veer off the core principles of Stoicism.

The essence of Stoicism lies in the pursuit of wisdom, virtue, and inner tranquility through the acceptance of what we cannot change and the diligent focus on what is within our control. Lately, I have observed an influx of posts that deal with personal struggles such as loneliness, loss, and betrayal. While these experiences are undoubtedly significant and deserve empathy and support, they are more suited for spaces dedicated specifically to personal support and self-help.

It is my sincere hope that the Stoicism subreddit will regain its focus on the teachings and practices that have brought us all together. Until such a time arises, I will be seeking out or possibly contributing to a new community that adheres more closely to the principles of Stoicism.

In the interim, I leave you all with a reminder to embrace 'amor Fati' – to love and accept all that happens, to find beauty and purpose in every twist of fate.",Stoicism,1695474999.0,t3_16q4b5q,0.45,0
Joe Rogan is into Stoicism?,"He just uploaded a photo of Marcus Aurelius and said that he’s reading meditations!

I heard one of his guest talking about Ryan Holiday, I think he’s gonna be on the podcast!",Stoicism,1649086720.0,t3_tw51dv,0.46,0
Friend keeps using N word,"Im from Australia, im of african descent, my friend of asian descent used the n word around me and instantly apologised and said they can’t help it and its a bad habit, i told them “its probably best to not use this word if u have to apologise to me every time you use it”. Then again a few weeks later they used the word and apologised and I again addressed them and told them that its affecting our friendship and to stop using the word, they minimized it by saying everyone is getting soft and reminiscing about their younger days when everyone did. They then mentioned they can use the F word as an example (derogatory for gays) if they were angry as it isn’t offensive then because “once they are angry they have no morals”. I called them immature and left it at that after accepting their apology. What would you do in a situation like this?

The word doesn’t necessarily bother me but the social stigma around it is very loud. And the fact that when used by a non black person, its responded to with gasps and apologies before im even able to react. Makes me believe that with some self awareness it should just be easy to just avoid using it.",Stoicism,1696085900.0,t3_16w9068,0.45,0
🔧Discomfort for Aug 18 - Don't eat your dinner,"Today, let's feel hunger. I'll try to feel growling by the time I go to sleep. I'll join my family at the dinner table, but use the time to think about the blessing of having food every day.",Stoicism,1597757713.0,t3_ic13e5,0.48,0
Can a stoic enjoy watching sport?,"I was watching the grand final of a national sport where I live (Australia) last night.

An ad came on for the trashiest reality tv I’ve ever seen. I thought about all the stoic quotes about being above that and avoiding those sorts of conversations at dinner parties.

I also thought about how they’re above shopping and that superficial, gossipy lifestyle in general.

Then I realised I was about to watch grown men run around on a field, cry when they lose, celebrate when they win. All over something that is made up and doesn’t matter in the scheme of things.

And so I thought, is it really that different?",Stoicism,1696198924.0,t3_16xevnp,0.5,0
Why stoicism and not Buddhism?,"I am interested in answers, from people who studied both stoicism and Buddhism and then chose stoicism.",Stoicism,1598808121.0,t3_ijghlt,0.56,10
My logic for ending it,"I have really screwed up life for me and my partner.  I got her pregnant and now just lost my job because of my incompetence and I’ll doubt I’ll get another job in the same field.  I’m also severely depressed.  She is 4 months pregnant.  I think the only way to help her and this child is to take myself out of the picture.  I have some savings and I could leave it all to her and the kid to use.  It could last them a few years.  

I think this is the best course of action.  I’m not sure what I’m looking for from this post.  Perhaps some reassurance in my logic to not be a burden to anyone.   Thanks.",Stoicism,1702679069.0,t3_18jc116,0.57,17
Stoicism is Bullshit,The only thing that seems to be taught from stoicism is to get over the fact that you have a shitty existence. Anyone who has actually gotten peace or happiness from this ancient ideology is someone who just preaches it over and over again.,Stoicism,1665702059.0,t3_y3cygs,0.45,0
Ryan Holiday and the Virtue of “Drag story-time”,"I was going to post a picture but it seems I’m not allowed to in the community (I don’t get on Reddit or the internet too often.) Ryan Holiday tweeted today about how he was putting on a “Drag story-time” at his bookstore, The Painted Porch. I refuse to acknowledge that exposing young children to explicitly sexual entertainment, such is the case at Drag shows, is actually virtuous and I’m actually the immoral one for wanting to halt “progress.” I would also argue anyone saying that it is virtuous needs a serious reexamination of their values. Which of the 4 virtues exactly is being ticked off when exposing children to sexual entertainment? I don’t want to get too political but this is the nature of the conversation. It seems as though Ryan, and a lot of Stoics quite frankly, take an incredibly surface level and emotionally satisfying approach to dealing with politics. I feel like as long as Ryan thinks he’s “on the right side of history” he can do whatever he wants, including children drag shows. I find it odd that during his daily email, he made some long screed about how terrible Jan 6th was, but I didn’t hear a word about the entire summer of riots earlier. Why? Those rioters were on the right side of history and were claiming they want to end racism and progress. It doesn’t matter if communities were destroyed and people lost their lives, they claimed to be the good guy. Either call it all out or call out nothing. Why should I take this guy seriously when he’s painting a dishonest view of the political world and advocating for drag shows for children? Lmk your thoughts",Stoicism,1657751049.0,t3_vyfq04,0.54,7
How can I accept that I will never gonna be able to get revenge on my worst bully?,"I've done it before on my cousin who bullied me for years and it felt good that I've finally freed myself from the trauma he caused me. I only got little punishment for it because I was still a minor at the time. But the triumphant feeling only lasted for a few months because I remembered that I have another bully who is just as worse. So I prepared for a few months for getting ready for my next revenge. I bought a heavy solid weapon, one ranged non-lethal weapon, and a sharp object. I grew my forearm muscle by swinging the heavy solid weapon for a few months and hitting my punching bag repeatedly as hard as I could everyday till I get tired. I improved on handling the sharp object by practicing using it everyday. I got rid of incriminating media and stuff in my house to not get additional charges. But by the time I was ready to face my bully after mustering up the courage for months, I have reached the legal age which makes it now impossible for me to get away with what I'm going to do with that bully. 

But the thing is, I can't let go of the anger I have towards him, because during the months of my preparation for my supposedly revenge, I recalled every single shitty memory I had with him to fill my heart with rage and use that anger to motivate me towards my goal and because of that I realized that he's actually the worst bully I ever had in my life. He belittled me, he always gave me unsolicited help which convinced me that I am incapable, he emasculated me, he humiliated me, he ridiculed my intelligence, he always invaded my personal space,  he forced me to do humiliating shit, he broke my stuff, he borrowed stuff from me and never returned it, he used my bedroom as his jerk-off space, he made fun of my parents, he did all of this while pretending to be my friend and using me for almost a decade. This is really messing with my mind and I can't even go through a day without having an anger outbursts.

Even though I know I'm now old enough to go to prison, I still feel like doing it. Because I feel like I wasted a lot of time and effort on preparing if I don't do it. And I feel like I just threw away my not-so-legal rare media and rare stuff that I worked hard to get for nothing if I don't do it. And I'm really chasing for that cathartic feeling followed by the act of revenge considering how much tremendous mental suffering he caused on me, I imagine it would feel so good again to release all of this mental burden.

I'm stuck in this cycle were I would feel confident on getting revenge on him and then on another day I will become depressed after getting a reality check that I will never receive justice on my own way. I've been like this for a more than a month now.",Stoicism,1671636949.0,t3_zrqyfn,0.52,1
