title,selftext,subreddit,created_utc,name,upvote ratio,num_upvotes
Crying after hanging out with exs friend,"So ex cheated on me by using dating apps etc. we’ve been seperate since for 3 months now. I am still friends with my exs friends and well the conversation tends to go to talking about my ex when i spend time with them and they fill me in about the exs new partner and relationship. Ive told them before I don’t want to speak of them and our friendship to be just about us but I tend to lose self control and dig deep when they mention them, im glad my ex partner is happy with someone else but after the function and at home I was crying and theyve been on my mind again, thoughts of the new partner and all the things they’ve said to me like promises for forever and etc. my healing process is consistent and ive been doing well but this hang out really kicked me down lol any advice will be appreciated",Stoicism,1695021293.0,t3_16lolu2,0.61,8
Becoming Undefeatable,"We must do our best to keep a cool head regardless of what life throws at us. We don’t have control over the majority of things that happen to us, but we do have all the control over how we react to those things. That is the most important dichotomy of control, the most important principle in stoic philosophy

A key central tenet of stoicism is knowing what we can control and what we can't. Worrying about things that are beyond our control accomplishes nothing. We should have a clear sense of what we can change and what we can't.

Remember the serenity prayer.

In the words of Epictetus, ""It's not what happens to you, but how you react that matters"".",Stoicism,1705512298.0,t3_19924pl,0.67,15
"Someone I looked up to told me to ""literally rot in hell"", instead of lashing out I moved on.","I got covid two weeks ago and posted on my private story ""I love having covid this is the happiest I've been in weeks"", because I live in an abusive household and for the first time in a long time they got to leave me alone. A lot of people miss-interpreted what i was saying and subtweeted me on twitter. One of my close friends even said something snarky about it, but I made an effort to talk it out with her to preserve the relationship. 

My best friend (let's call her emma) told me that this other girl, laura, was really mad about what i said and Emma would not go into specifics about what Laura was saying. Laura is a grade older than me and I always thought she was super cool and I really wanted to get to know her better. Emma told me that Laura was ranting on her private story so she did not get the whole thing but I could tell she was holding back. Because she was not being upfront with me I knew there was more to the story and I instantly got really triggered and I struggle with self harm so I decided I was going to self harm that night because I was so upset. Later I asked my friend Emma what Laura said again in hopes I would get a forward answer and Emma said it was on Laura's twitter. I looked everywhere for this girl's twitter and when I found it I saw that she made a tweet that said that I should ""literally rot in hell"" for getting covid and being happy about it. She also unfollowed me on all of my socials which obviously hurt because I wanted to maintain a relationship with her. I spent the next half an hour crying really hard and self harming, but I realized that I don't have control over what Laura thinks or feels and I should not waste time blaming myself. I had cut deeper tonight then I ever had and I just wanted to keep going which scared me. So instead, I went on a really intense run and put on music really loud in my headphones. 

Even though I looked up to this girl and I am sad that she resents me for a misunderstanding, I cannot control how she feels at all. It is not up to me to decide how she feels but I need to take responsibility and control my response.",Stoicism,1654855214.0,t3_v94b23,0.63,10
"What's another subreddit for stoicism since nothing seems very stoic here anymore, it's more get motivated posts than anything",,Stoicism,1531927914.0,t3_8zwi1h,0.63,11
I accept that I’m a loser,"

I’m 20M and I’m a loser 

I spend so much time studying and trying to work hard yet my grades and results are always mediocre or bare minimum average. It’s truly pathetic. 

I’m 20 years old and I’ve never been with a girl in all of my existence. 

I’m so socially awkward and I come off as insecure but that’s due to my incompetence and lack of confidence

I’ve failed at so many times thing in my life I can’t think of anything I’m good at. In order to be confident you have to be good at something, or set goals and achieve them. But if your entire life is nothing but failures then how can you be confident. 

I hate being incompetent it makes me feel so useless however despite my best efforts to not be incompetent I always end up in situations where I find myself feeling incompetent.

It frustrated me so much last year till the point I dreaded my existence now I just accept this as who I am. No matter what I do I can’t change it so rather than beat myself up over the head. I accept it.

Sure it’ll annoy or frustrate me sometimes but after doing your best and trying so hard what else can you do besides embrace it.

All I can do is work on myself to the  best of my ability. Try to eat right, gym, and meditate. 

At least try even if it’s a little.",Stoicism,1675495619.0,t3_10t7zt5,0.68,23
"If Marcus Aurelius had reddit, he probably wouldn’t have downvoted people. Just some food for thought.","It really gets to me when people downvote me but I’m trying to not let it. I also have to keep in mind the other side of this equation and not downvote others when they piss me off. 

It also doesn’t help when I go to self improvement subreddits only to get mocked and shamed. Disheartening, but alas. I carry on. 

Anyone else experience something similar online? Any tips?",Stoicism,1641584263.0,t3_ryfu25,0.32,0
Can I be a Stoic Christian?,I know a bit about stoicism and I really like it’s ideology but I am a Christian I’m wondering if a Christian can be stoic or at least adopt some of the ideas and call themselves stoic,Stoicism,1681605060.0,t3_12nolyc,0.6,6
"""None of us have to go to anyone. And the idea that we do is a mental illness we contracted from commercials and Sandra Bullock. We can't keep going to each other until we learn to go to ourselves. Stop making our hatred of ourselves someone else's job, and just stop hating ourselves""","From one of my favorite shows, ""Community"".",Stoicism,1635178345.0,t3_qfk6ca,0.63,7
Depression is like living in a body that fights to SURVIVE with a mind that tries to DIE,,Stoicism,1573918751.0,t3_dx8db3,0.64,8
Serenity,,Stoicism,1540683935.0,t3_9rywet,0.39,0
Why do I get a longer life than others?,"I think of so many celebrities who died at a very young age. Chadwick Boseman, for example who was not only a remarkable actor, but an incredible human being. He passed away from Cancer at 43 i believe. I am currently 46, working at a job thats close to minimum wage. No friends (my choice) , just have my wife. Im very introverted. I don't own a house, or car, or have a licence. I live paycheck to paycheck, and have other mental health issues. So my question is, why would God take away life from people who make a difference in this world, but keep me? I know it sounds like im putting myself down but really, why? I don't seem to have a ""purpose"" in life, yet others did, and their lives were cut short. 

I seem to coast through life, then i hear of good people dying at early stages of life. I haven't done anything to deserve my life. Sometimes i feel like im just existing. Im pretty happy for the most part, but i get up, go to work, come home, go to bed, get up etc.

I work to make a company rich. Thats my life. What do i get? 18 bucks an hour! Gee, sounds great. That means i can't afford any place to live unless my wages magicly go up another $20 bucks an hour! Im not saying i deserve to get Cancer and die, but why does it happen to good people, and people like me get a longer life? Doesn't seem fair.",Stoicism,1695657529.0,t3_16rvz2b,0.67,21
Is it okay to cry as a stoic?,"I have been following stoicism for under 6 months now and I’m aware of some texts regarding this and how crying is essentially a waste of time. I’m becoming better at understanding my emotions and learning not to simply act on them. 

But there are days like today, for whatever reason, where I just feel the desire in me to cry. It feels comparable to when I haven’t masturbated for some time and I simply want a release. Not an emotional release although It could be from a build up of stress from these new ways I’m trying to handle stress since applying stoic philosophy to my life. 

Anyone have any advice? Is it ok to ball for a few minutes and then move on? As always, I appreciate your advice.",Stoicism,1687535268.0,t3_14h1z3k,0.68,22
Ex moving on too quickly.,"I do not want to get into too much details but I just wanted to vent things out. She was my first love. We were in a on-off relationship for 5 years. She breakups with me a lot for a reason like she can't love or ""its not you, its me"" type of shit. I thought she was pretty great as a partner so tho I regret now, I usually am the one that is reaching out to come back together. We usually comeback together after a few months for five years. WE never lasted a year tbh.  
  
We were pretty immature i know but one thing is for certain is that I loved her genuinely. Our last relationship lasted for almost a year. Almost. She wanted to breakup. I didn't accept it at first because i thought she was being impulsive again but after a week I decided to let her go though it was hard. I regret that I begged to her to stay and im cringing rn but we learn from mistakes. No one should beg to be loved. Now, I wasn't the perfect partner. I was needy, obsessive maybe, and overthinker. My mental space got the better of me you know. But I dont give up. Im the type of person that would say ""I dont want to lose you, lets fix things"" but seems like she didn't want that or maybe not from me.  
  
The reason for breaking up this time was a bunch. (1) She fears commitment. We were together a long time but I wasn't given the chance to meet her parents. I wasn't forcing her to let me meet her parents but I find it weird that she seems she doesn't want that. (2) She ""can't"" love again. I know this was her usual reason for breaking up. I can't understand it tho I know i don't have to. (3) She doesn't have the time and space for relationships rn. Tho i find hard to believe because we were together for almost a year and now she just realized this which was weird to me. (4) She just wants to be alone and that she is not happy anymore and she feels like drowning or choking. I respect that reason tbh. When she said that I knew I had to let her go. I wanted her to be happy. In the end (i regret asking rn), in which i asked ""Do you promise once your ready, you'll chose me?"" and she said yes. The relationship ended on good terms. No bad blood. i thought there was a high chance of coming back together again.  
  
After a few months, I started that to went to no contact, work on myself, workout, study, work on my portfolio. It was okay. I was dealing with the breakup much better than I was before. Healthily coping with my pain. It was horrible but i know i got through this before. But its only a matter of time before a painful news get to me.  
  
Recently, My family and I was on vacation. I had a great time. When suddenly my friend chatted and broke the news, that she has a new partner, her classmate (we were in different colleges). I saw her account shes flaunting his new guy all over her social medias. There is this specific picture that shows him in her place which means he met her parents. Its only been 4 months. It was horrible. Like your body just sinks. Like every reason that she wanted to breakup was a lie. The promise was a lie. I wanted to cry but I couldn't cause my family is there with me. I never knew I could experience worse pain than I had before. Like i thought she promised. I thought she was better than that. The thoughts, memories, pain came back. Its like my world shattered you know. Thats when you realize that the world is unfair. It was an unimaginable pain that I've been through. You asked yourself a bunch of questions about your self-worth. ""Was I enough?"", ""Was i too much"". ""Was I not worth the risk or pain?"" I realized that she ended the relationship for the sole reason that she does not love me anymore, and the reasons that she gave was just white lies to cushion the blow that she is going to make .I did my best for her and for the relationship. I wanted her to be happy. I like to think of it as like a game of chess, i did all the possible best moves but in the end I still lost. Hopefully, she is happy now, unfortunately not with me.  
  
Its been a month, and Im feeling better but the pain is still there. Im getting better at dealing with my thoughts. But I believe the worst part is the memories. Songs that will remind you of them. Catchphrases that will remind you of them. Places that will remind you of them. It feels like hell. It HURTS like hell. But I know i cant do anything about it anymore. I feel like I already know what I need to do. Work on myself again. Focus on myself. Emotionally heal from this traumatic experience. I just wanted to vent this out. As a man, its hard to find mediums to freely express your emotions.

I have been using stoicism to cope with my pain. Im sure me feeling pain is my own fault. I expected her to be someone that would not do that. I caused my own pain. Its beyond my control anymore. I would like some quotes that would enlighten and bring me clarity. I would also take some book recommendations as I already finished Mediations by Marcus Aurelius and Discourses by Epictetus.
  
If you're still reading this, (I know its long but It could be longer) Thank you for taking the time. If you have any insight or support especially about stoicism, It will be greatly appreciated. I hope that you are not going through the same stuff or worse. I'm sure everything will be alright in the end.",Stoicism,1693997287.0,t3_16bgyep,0.34,0
Remember when is the lowest form of conversation,"Yep Tony Soprano was a stoic (kind of).

Remember when? Focus on what you control!

Everything up until this moment is gone. You cannot control it no matter how much you want to.

Constantly dwelling on the bad things in your past is toxic, unless you take learnings from them. 

But the flip side is that dwelling on the ‘best days of your life’ may be equally as bad. 

Don’t dine out on who you used to be.

You’re here. In this moment. 

Positive self talk is obviously a good thing. 

But if your self talk is all tailored to ‘remember when I did ‘abc’ then you’ll never get to ‘xyz’.",Stoicism,1680996801.0,t3_12g24iu,0.63,9
Stoicism is nonsense,"Been reading stoicism, and jesus, what a waste of time. All of this is just hippie bullshit. ""Shit just happens, yo! So don't get hang up on it because things get better"". This shit is nothing more than ramblings of privileged suckers so far up their asses that they had a mental breakdown every time they stubbed their toe, so they had to come up with a phony philosophy to make themselves feel better. What a load of bollocks.",Stoicism,1625267697.0,t3_oclzrz,0.68,19
A message for the mods,"Just because some don’t use quotes from your favourite stoic books or use a language structure from centuries ago doesn’t mean the comment isn’t pointing towards understanding one’s self.

I’ve had 3 comments removed by mods that prior to there removal had fantastic feedback from the community.

It makes it extremely difficult to navigate how to interact with others in this sub.",Stoicism,1699753055.0,t3_17t9jxi,0.69,30
[offtopic] Whenever I'm near this portal I make sure to capture it with maximum effect :),,Stoicism,1400988923.0,t3_26f7wa,0.41,0
I dont understand how the stoics lived in the same reality as me yet interpreted reality very differently?,from me or most people today. i mean if you read seneca he mentions the god jupiter and he says we have an understanding of all things that nothing stands still except the earth. He was so convinced he knew these things yet we know hes wrong from our present knowledge. SO how do we know any of his arguments work ?  is  it up  to the individual to decide if they like what seneca says,Stoicism,1703598753.0,t3_18r8ki8,0.38,0
Jordan Peterson: Anti-Stoic,,Stoicism,1527112190.0,t3_8lna75,0.57,4
How to overcome lust,I am a 14 year old porn addict who jerks off everyday but I want to change that but I find it very hard to fight the urge to watch porn,Stoicism,1701591537.0,t3_189p3l3,0.68,20
Embarrassed by past self,"I lived with my mom from age 11 onwards and she raised me to be very soft and weak. ( I’m a male). 

She wanted to hold my hand in public even when I was 13. 
I used to cry to her over small issues and would cry in public. 

I’m embarrassed about this immaturity now as an adult because I’m afraid of people I know having seen me this way. 

How do I get over it?",Stoicism,1700580873.0,t3_180jpny,0.65,14
Is there a real reddit about stoicism?,"Stoicism is not about dating or work success, it is about being one with nature and understanding that you are the only one that is in charge of your life. 

Any place where I can find REAL discussions about stoic philosophy? 

BTW, for all of you out here that get your stoic content via YouTube, you are missing the point of philosophy. You are just absorbing someone else’s take on Stoicism which makes it really hard for you to actually think for yourself.

Sry bad English, I dumdum I know",Stoicism,1615707369.0,t3_m4qnuq,0.67,15
I think life is over for me,"So last night I(21M) can home drunk, got into and arguement with my father and them he ask why do I drink so much, to which I broke down and told him,

how I had so many goal's and ambitions that I needed to achieve before I turned 20 but I didn't even come close to one of them, which just lead to my mental health going downhill and now I have serious stress, anxiety and ADHD.

I try to cramp up all I can but I just feel i'll never get that time I wasted back again, I ended all my social life avoided parties, never had a girlfriend, still a virgin, hoping that when I turn 20 I would have all and my life will start to perfect.

But now I'm 21 I have nothing literally nothing, no friends, no girlfriend, no money, no job, nothing, life is over for me I think.

And hence to get over the fact I drink alot.",Stoicism,1671691949.0,t3_zsf2zb,0.74,156
Giving up on practicing Stoicism after 2 months,"Hey community,

I'm reaching out for support as I navigate through some tough times. At 29, I've recently lost my job and ended a 4-year relationship due to my own lack of discipline. These setbacks have left me feeling uncertain about the future and emotionally overwhelmed.

Facing this dual challenge, I've reached out to some stoic learning resources like articles and vlogs and ended up recognizing that I need to cultivate **Courage** and **Temperance** to tackle the emotional aftermath. 

Over the past two months, I've attempted Stoic exercises such as Journaling, Premeditatio Malorum, and Negative Visualization to find solace and direction. However, I must admit that I've struggled to stay consistent and haven't seen the progress I was hoping for. It's clear that I lack guidance in applying these practices effectively. More importantly, most of the time, I don't feel like I'm applying Stoicism in my life when doing these exercises, but it feels more like boring daily tasks.

Have any of you experienced similar challenges with implementing Stoic practices at the beginning of the journey? How did you overcome obstacles and stay committed? ",Stoicism,1700149719.0,t3_17wq2n6,0.64,11
"Bryce: ""The mind, unconquered by violent passions, is a citadel, for a man has no fortress more impregnable in which to find refuge and remain safe forever."" (8.48) First in a series of videos in which different people read quotations from The Meditations of Marcus Aurelius.",,Stoicism,1547077006.0,t3_aecvxq,0.65,14
Just got this tattoo,,Stoicism,1535921986.0,t3_9cfhle,0.65,13
Is it hard to live a stoic life in the USA?,"Some background (and don't be offended, which maybe you would):

I am originally from Hungary. For those that don't know, it has a thousand years old culture stemmed in nomadic lifestyle, wars, and creative adaptability in extreme measures, it lost two world wars, 70 percent of its land, and then was occupied by the Nazies and then by the Soviets for about 45 years -both of whom did genocides- and had to pay war reparations, had the highest inflation in human history, and had about 5-6 revolutions and changes of state form in a century, and now is being ruled by a corrupt regime. And people live their lives.

I decided about 4 years ago, that I will soon move the USA to live the American dream. For that to make money, I worked in a Scandinavian country, where I started to somewhat doubt that I want to live around people who are not cold, stoic, and non-problematic in the Nordic way. I know personally many American people very closely, and even lived with them.

My concern is that maybe not only Western people cannot take life seriously, but they even pull others into this non-serious approach, and their lives are full of noise, sugar, air conditioner, lukewarmness, and many has a physique, intelligence and communicational style not compatible with normal human survival, and they are sometimes so entitled that they get offended by the existence of another person, or by somebody having an opinion that they label as ""not nice"". And they always ask ""how are you"", and deep and personal questions in situations where there is no place for that, and they expect you to give a shallow and indifferent anwser regarding your own life.

On the other hand, I love freedom, I am a very risk-taking and innovative person, and I like to create value while nobody is trying to use force on me, and I have a big dream of building up a business and having a nice and big family in the USA and live the American dream.

Is my concern legit, or is it possible to live a normal productive life in the USA?",Stoicism,1690967543.0,t3_15g3vxt,0.7,28
hi,"hi nice to meet every one. i'm fairly new to stoicism, been aware of for a long long time but never really paid much attention to it. lately i've been reading some of the available material and realized that over a life time of experience i've come to many similar conclusions. like trying to accept things for what they are instead of what you want them to be and you'll rarely be disappointed. 

it will be nice to learn more about the philosophy and how to implement it. 
",Stoicism,1370320175.0,t3_1fmrpm,0.63,8
I made an inappropriate joke to someone and their reply was hurtful. How do I subvert my expectations of being apologized to?,"This is a fake scenario based off of a real problem I'm having.

I'm confused in how to feel and how to respond to they way someone reacted to a joke I made.

So let's say I, Jack, made a joke about vegans to my friend Mark, who is not a vegan but has told me previously that they don't like jokes at the expense of vegans.

After telling my joke, Mark said ""shut up, that's offensive"".

Now, upon reflection I realized that I made a mistake. There's no doubt in my mind that the initial mistake was mine. However I still feel hurt due to being told to shut up.

I have apologized for making the joke, and Mark hasn't apologized for his response. I feel like I expect him to apologize. Should I not?

This is something which isn't yet clear to me in the stoic teachings. I lack ""the wisdom to know the difference"". I know his apology is out of my control, but should (or could) I tell him that it was hurtful and that I would like if he doesn't do it again?

Or do I just change my expectations to such a degree in which I won't expect to be treated with any respect?

Thanks in advance for any help and guidance.",Stoicism,1704301923.0,t3_18xo8kz,0.34,0
Productive Evening Rituals Of Highly Successful People,,Stoicism,1525013961.0,t3_8fru2x,0.62,8
The Joy of Marriage and child rearing should be experienced by us Stoic Practitioners.,"A passage from the book “A Guide to the Good Life - The Ancient Art of Stoic Joy” by William B. Irvine (pg. 140-141), tells us of marriage while quoting Musonius Rufus. 

“A wise man, Musonius says, ‘will marry, and having married, he and his wife will work hard to keep each other happy. Indeed, in a good marriage, two people will join in a loving union and will try to outdo each other in the care they show for each other. Such a marriage, one imagines, will be very happy. And having married, a wise man will bring children into the world. No religious procession’, Musonius says, ‘is as beautiful as a group of children guiding their parents through the city, leading them by the hand and taking care of them. Few people’, Musonius would have us believe, ‘are happier than the person who has both a loving spouse and devoted children.’”

Let us find that person who loves us, and who we love in return. A partnership embodied by virtue. What could aid more in your own journey than a good traveling partner? 

Bringing children into the world, educating them, being there for them, sharing in their joys and their failures, becoming old, sending good humans onto the same journey that we ourselves carried all those years, then dying a peaceful death. 

What a joy!",Stoicism,1638074836.0,t3_r3w3ru,0.75,129
